{"$id":"https://readme-showcase.local/schemas/delivery-result.v1.schema.json","$schema":"https://json-schema.org/draft/2020-12/schema","$defs":{"branch":{"maxLength":128,"minLength":1,"pattern":"^(?![-/.])(?!.*(?:\\.\\.|//|@\\{|\\\\| ))(?!.*(?:/|\\.|\\.lock)$)[A-Za-z0-9._/-]+$","type":"string"},"commit":{"pattern":"^[0-9a-f]{40}$","type":"string"},"sha256":{"pattern":"^[0-9a-f]{64}$","type":"string"}},"additionalProperties":false,"allOf":[{"if":{"properties":{"status":{"const":"delivered"}}},"then":{"properties":{"commit_sha":{"$ref":"#/$defs/commit"},"pr_number":{"minimum":1,"type":"integer"},"pr_url":{"format":"uri","pattern":"^https://github\\.com/[^/]+/[^/]+/pull/[1-9][0-9]*$","type":"string"},"reason":{"type":"null"}}}},{"if":{"properties":{"status":{"const":"failed"}}},"then":{"properties":{"commit_sha":{"type":"null"},"pr_number":{"type":"null"},"pr_url":{"type":"null"},"reason":{"pattern":"^E_[A-Z0-9_]+$","type":"string"}}}}],"properties":{"attempts":{"minimum":0,"type":"integer"},"branch":{"$ref":"#/$defs/branch"},"commit_sha":{"type":["string","null"]},"idempotent":{"type":"boolean"},"operation_id":{"$ref":"#/$defs/sha256"},"pr_number":{"type":["integer","null"]},"pr_url":{"type":["string","null"]},"reason":{"type":["string","null"]},"schema_version":{"const":1},"status":{"enum":["delivered","failed"]}},"required":["schema_version","status","operation_id","branch","commit_sha","pr_url","pr_number","reason","attempts","idempotent"],"title":"GitHub delivery result v1","type":"object","x-python-semantic-validation":{"code":"E_DELIVERY_RESULT"}}
