{"attempts":4,"branch":"readme-showcase/aaaaaaaaaaaa","commit_sha":"cccccccccccccccccccccccccccccccccccccccc","idempotent":false,"operation_id":"eeeeeeeeeeeeeeeeeeeeeeeeeeeeeeeeeeeeeeeeeeeeeeeeeeeeeeeeeeeeeeee","pr_number":7,"pr_url":"https://github.com/owner/repo/pull/7","reason":null,"schema_version":1,"status":"delivered"}
